{"account_id":"acct.paper.01","capital_adequate":true,"created_at":"2026-09-04T18:00:00Z","estimated_loss_bps":1755,"estimated_loss_usd":"17550.00","liquidity_haircut_usd":"2400.00","scenario_name":"2008 Financial Crisis Replay","shock_assumptions":{"equity_shock_pct":"-40.0","financing_rate_shock_bps":150,"spread_expansion_multiplier":"4.0","volatility_multiplier":"2.8"},"simulation_id":"loss-sim.stress-2008-crash","simulation_schema_version":1,"stressed_margin_utilization_pct":"68.5"}
